ArticleChunkID,ArticleID,Link,Published,Source,Summary,Title,name,Content,sector,industry,impact,reasons,news_summary,news_title
2,440,https://www.marketbeat.com/stock-ideas/3-vital-copper-stocks-helping-evs-and-ai-data-centers-take-off/,1716189000,www.marketbeat.com,"Three copper stocks could help investors get additional upside for their portfolios, especially if they are missing influence from the AI and EV trends",3 Vital Copper Stocks Helping EVs and AI Data Centers Take Off,Crude Oil,new players popping up nearly every day many investors follow the hype behind these industries relatively blindly But trying to pick the winner among dozens of potential companies or spreading your eggs across many baskets hoping for one to win is akin to venture capital investing Thats not the goal here Get Hudbay Minerals alerts Sign Up A surefire way to guarantee a return on investment is by backing the necessary materials and industries that allow EVs and AI to take off Lithium already had its run in popularity giving copper a spot in line to become the next hot issue with stocks like Ero Copper Corp NYSE ERO Hudbay Minerals Inc NYSE HBM and Newmont Co NYSE NEM Why Copper Matters in These Trends Copper is a critical material for power distribution in data centers that house the most advanced computers dealing with machine learning and other AI computing processes Its also a crucial component in the batteries that guarantee EVs work and can scale to take on the combustion engines,Energy,Oil & Gas,negative,"1. The news article highlights the increasing popularity of Electric Vehicles (EVs) and Artificial Intelligence (AI), which could potentially reduce the demand for crude oil in the long term as these technologies become more widespread and efficient.
2. The article mentions that copper is a critical material for the batteries used in EVs, suggesting that the demand for copper may increase as the EV market grows. This could lead to a shift in investment away from oil and gas companies and towards copper mining companies.
3. The focus on copper as a crucial component in data centers and AI computing processes could also indicate a growing interest in the technology sector, which may draw investment away from traditional energy sources like crude oil.","""3 copper stocks, Ero Copper Corp, Hudbay Minerals Inc, and Newmont Co, are highlighted as vital for the growth of EVs and AI data centers. Copper is essential for power distribution in data centers and a crucial component in EV batteries. These stocks offer a potentially safer investment compared to picking individual EV or AI companies.""","""Copper Stocks: Key Players and Their Role in EVs and AI Data Centers"""
6,444,https://www.marketbeat.com/originals/deere-and-companys-q2-report-strong-revenue-cautious-outlook/,1715941800,www.marketbeat.com,"Deere & Company's Q2 earnings report reveals a complex scenario for the equipment giant, highlighting strong revenue, profitability, and industry challenges.","Deere & Company’s Q2 Report: Strong Revenue, Cautious Outlook",Crude Oil,sectors challenges and subsequent impact on Deeres business Analysts are concerned about the nearterm outlook for the agricultural sector citing the impact of lower commodity prices higher input costs and declining farm income They are also watching for signs of improvement in the global economic environment which could provide some relief to the agricultural sector Analysts remain optimistic about Deeres longterm growth potential despite the nearterm headwinds They highlight the companys investments in technology such as precision agriculture and its commitment to sustainability initiatives as key drivers of future growth Deeres LongTerm Strategy Deere Company MarketRank Stock Analysis Overall MarketRank out of Analyst Rating Moderate Buy UpsideDownside Upside Short Interest Healthy Dividend Strength Moderate Sustainability News Sentiment Insider Trading NA Projected Earnings Growth See Full Details Despite the nearterm challenges facing the agricultural sector Deere Company remains,Energy,Oil & Gas,negative,"1. The news article mentions ""lower commodity prices"" which can negatively impact the profitability of companies in the energy sector, including those involved in the production and trading of crude oil.
2. The article also highlights ""declining farm income"" which can reduce the demand for energy products, including crude oil, from the agricultural sector.
3. Additionally, the news mentions ""higher input costs"" which can increase the operating expenses for companies in the energy sector, potentially reducing their profitability and impacting their stock prices.","""Deere & Company's Q2 report shows strong revenue but a cautious outlook due to challenges in the agricultural sector, such as lower commodity prices, higher input costs, and declining farm income. Analysts remain optimistic about Deere's long-term growth potential, highlighting its investments in technology and sustainability initiatives. The company's MarketRank is moderate buy, with a healthy upside and moderate sustainability.""","""Deere & Company's Q2 Report: Strong Revenue, but Analysts Cautious on Near-Term Agricultural Sector Challenges and Long-Term Growth Potential"""
4,847,https://www.cnbc.com/2024/05/22/wednesdays-top-stock-calls-like-nvidia.html,1716404202,search.cnbc.com,Here are Wednesday's biggest calls on Wall Street.,"Here are Wednesday's biggest analyst calls: Nvidia, Meta, Tesla, Chipotle, Ferrari and more",Crude Oil,that can help drive higher usage and incremental ad spend Maintain Buy Oppenheimer reiterates Chipotle as outperform Oppenheimer raised its price target on the stock to per share from CMGs relative menu pricing vs competition has improved since our October study highlighting its robust pricevalue as an ongoing traffic driver Goldman Sachs upgrades Shopify to buy from neutral Goldman Sachs said it sees a compelling entry point for shares of Shopify We upgrade Shopify from Neutral to Buy with upside to our updated month price target of Piper Sandler upgrades Kraft Heinz to overweight from neutral Piper Sandler said it has better visibility for the food products company We upgrade to OW with incrementally better visibility on KHCs upside in Foodservice helped by its new innovation in timesaving and laborsaving dispensers which we expect can drive incremental revenues within existing relationships and some incremental distribution Morgan Stanley reiterates McDonalds as overweight Morgan,Energy,Oil & Gas,positive,"1. Increased consumer spending: The positive news about Chipotle and McDonald's suggests that these companies are performing well, which could indicate a stronger economy and increased consumer spending. This could lead to increased demand for oil and gas, as consumers may be more likely to travel and engage in other activities that require the use of these commodities.
2. Improved economic outlook: The upgrades of Shopify and Kraft Heinz by Goldman Sachs and Piper Sandler, respectively, suggest a more positive economic outlook. This could lead to increased business activity and industrial production, which would in turn increase demand for oil and gas.
3. Increased food service demand: The news about Kraft Heinz and its new innovation in food service could lead to increased demand for oil and gas in the food service industry. This is because the new innovation is expected to drive incremental revenues within existing relationships and some incremental distribution, which could require more energy to produce and transport the products.","Several analysts have made significant calls on various stocks. Oppenheimer reiterated its buy rating on Chipotle, raising its price target to $1,850 per share, citing improved relative menu pricing and robust price-value as a traffic driver. Goldman Sachs upgraded Shopify to buy from neutral, seeing a compelling entry point for shares and setting a price target of $1,200. Piper Sandler upgraded Kraft Heinz to overweight from neutral, citing better visibility for the food products company. Morgan Stanley reiterated its overweight rating on McDonald's.","""Analysts Upgrade Shopify, Kraft Heinz, and Chipotle; Maintain Buy Ratings on McDonald's and Nvidia"""
14,454,https://www.marketbeat.com/learn/why-invest-in-5g-stocks/,1715871240,www.marketbeat.com,"5G technology represents a foundational shift in how we connect and interact with technology, and provides opportunities for potential growth and innovation.",Investing in 5G Stocks: Still an Opportunity,Crude Oil,Understanding the diverse landscape of G investments — from infrastructure and hardware to service providers and application beneficiaries — is crucial By focusing on key players in the market and staying informed about industry trends and regulatory developments you can strategically position yourself to capitalize on the growth of G The current economic environment and the ongoing expansion of G coverage present a compelling case for both shortterm gains and longterm growth potential With careful analysis and a diversified approach investing in G stocks can be a profitable addition to any investment portfolio,Energy,Oil & Gas,positive,"1. The news article highlights the ongoing expansion of G coverage, which could lead to increased demand for energy sources, including crude oil, to power the infrastructure and hardware required for G networks.
2. As G investments grow, there could be a positive impact on economic activity, leading to higher energy consumption and, consequently, increased demand for crude oil.
3. The focus on key players in the market and staying informed about industry trends, as mentioned in the news article, could lead to more efficient and technologically advanced operations in the oil and gas industry, potentially reducing costs and increasing profitability for companies in this sector.","5G stocks still offer investment opportunities; understand the 5G landscape, focus on key players, stay informed about trends and regulations, consider short-term gains and long-term growth, and use a diversified approach for a potentially profitable investment.","""Strategic 5G Investment: Focus on Key Players and Industry Trends for Long-Term Growth"""
4,500,https://www.cnbc.com/2024/05/20/stocks-making-the-biggest-moves-midday-hims-hers-health-norwegian-cruise-line-target-and-more.html,1716243873,search.cnbc.com,These are the stocks posting the largest moves in midday trading.,"Stocks making the biggest moves midday: Hims & Hers Health, Norwegian Cruise Line, Target and more",Crude Oil,Dell Technologies — Microsoft gained ahead of its Build developer conference that kicks off Tuesday Dell Technologies shares dipped as it holds its own developer event NextDecade — Shares jumped after the UAEs stateowned oil company said it secured a stake in NextDecades Rio Grande liquefied natural gas or LNG export project NuScale Power — The nuclear power stock advanced Uranium stocks have recently gained after President Joe Biden signed a bill banning imports of Russian uranium for nuclear fuel Year to date NuScale is up more than — CNBCs Michelle Fox Lisa Kailai Han Alex Harring and Samantha Subin contributed reporting,Energy,Oil & Gas,positive,"1. The positive news about Microsoft's Build developer conference could indicate a potential increase in demand for technology and services, which could indirectly boost the energy sector, including crude oil.
2. The announcement of the UAE's state-owned oil company securing a stake in NextDecade's Rio Grande liquefied natural gas (LNG) export project could signal a growing interest in energy projects, potentially leading to increased demand for crude oil.
3. The recent gains in uranium stocks, partly due to President Joe Biden's ban on Russian uranium imports, could indicate a broader positive trend in the energy sector, including crude oil. This could be due to a shift in focus towards energy security and diversification of energy sources.","Several stocks are experiencing significant movement in trading. Dell Technologies and NuScale Power are seeing gains, while NextDecade has jumped after securing a stake in a LNG export project. Microsoft is also up ahead of its Build developer conference. On the other hand, Dell Technologies shares dipped as it holds its own developer event. Uranium stocks have recently gained after President Joe Biden signed a bill banning imports of Russian uranium for nuclear fuel. Year to date, NuScale Power is up more than 200%.","""Microsoft, Dell, Norwegian Cruise Line, Target, NextDecade, NuScale Power - Stocks Moving Midday on Various Developments"""
2,440,https://www.marketbeat.com/stock-ideas/3-vital-copper-stocks-helping-evs-and-ai-data-centers-take-off/,1716189000,www.marketbeat.com,"Three copper stocks could help investors get additional upside for their portfolios, especially if they are missing influence from the AI and EV trends",3 Vital Copper Stocks Helping EVs and AI Data Centers Take Off,Natural Gas,new players popping up nearly every day many investors follow the hype behind these industries relatively blindly But trying to pick the winner among dozens of potential companies or spreading your eggs across many baskets hoping for one to win is akin to venture capital investing Thats not the goal here Get Hudbay Minerals alerts Sign Up A surefire way to guarantee a return on investment is by backing the necessary materials and industries that allow EVs and AI to take off Lithium already had its run in popularity giving copper a spot in line to become the next hot issue with stocks like Ero Copper Corp NYSE ERO Hudbay Minerals Inc NYSE HBM and Newmont Co NYSE NEM Why Copper Matters in These Trends Copper is a critical material for power distribution in data centers that house the most advanced computers dealing with machine learning and other AI computing processes Its also a crucial component in the batteries that guarantee EVs work and can scale to take on the combustion engines,Energy,Oil & Gas,positive,"1. Increased demand for energy: The news article highlights the growing demand for electric vehicles (EVs) and artificial intelligence (AI), both of which require substantial energy to operate. As a result, there will be a higher demand for energy sources, including natural gas, which is commonly used in power generation.
2. Infrastructure development: The expansion of EV and AI industries will lead to increased infrastructure development, such as data centers and charging stations. Natural gas is a crucial component in power distribution for these data centers, which will drive up demand for the commodity.
3. Industrial growth: The growth of the EV and AI sectors will have a positive impact on various industries, including the oil and gas sector. As these industries expand, they will require more raw materials, such as copper and lithium, which are used in the production of EVs and AI technologies. This increased demand for raw materials will, in turn, boost the demand for energy sources like natural gas.","""The article highlights the growing importance of copper in the Electric Vehicle (EV) and Artificial Intelligence (AI) industries, particularly in data centers and batteries. It mentions three stocks, Ero Copper Corp (NYSE: ERO), Hudbay Minerals Inc (NYSE: HBM), and Newmont Co (NYSE: NEM), as potential investment opportunities due to their involvement in copper production.""","""Copper Stocks: A Promising Investment as Electric Vehicles and AI Data Centers Surge"""
14,454,https://www.marketbeat.com/learn/why-invest-in-5g-stocks/,1715871240,www.marketbeat.com,"5G technology represents a foundational shift in how we connect and interact with technology, and provides opportunities for potential growth and innovation.",Investing in 5G Stocks: Still an Opportunity,Natural Gas,Understanding the diverse landscape of G investments — from infrastructure and hardware to service providers and application beneficiaries — is crucial By focusing on key players in the market and staying informed about industry trends and regulatory developments you can strategically position yourself to capitalize on the growth of G The current economic environment and the ongoing expansion of G coverage present a compelling case for both shortterm gains and longterm growth potential With careful analysis and a diversified approach investing in G stocks can be a profitable addition to any investment portfolio,Energy,Oil & Gas,positive,"1. The news article highlights the growth potential of ""G"" investments, which could include companies that provide infrastructure or services for the natural gas industry. As these companies grow, they may increase their demand for natural gas, driving up prices and benefiting your stocks.

2. The ongoing expansion of ""G"" coverage mentioned in the article could lead to increased economic activity and industrial production, which are significant consumers of natural gas. This increased demand could positively impact the price of natural gas and, in turn, your stocks.

3. The article emphasizes the importance of staying informed about industry trends and regulatory developments. Positive regulatory changes or industry trends for ""G"" investments could indirectly benefit the natural gas industry, leading to improved market sentiment and higher stock prices for your natural gas holdings.","5G stocks remain a promising investment opportunity; understand the 5G landscape, focus on key players, stay updated on trends and regulations, and maintain a diversified approach for potential short-term gains and long-term growth. The current economic environment and ongoing 5G expansion make it an attractive addition to investment portfolios.","""Strategic 5G Investing: Focus on Key Players and Industry Trends for Long-Term Growth"""
4,500,https://www.cnbc.com/2024/05/20/stocks-making-the-biggest-moves-midday-hims-hers-health-norwegian-cruise-line-target-and-more.html,1716243873,search.cnbc.com,These are the stocks posting the largest moves in midday trading.,"Stocks making the biggest moves midday: Hims & Hers Health, Norwegian Cruise Line, Target and more",Natural Gas,Dell Technologies — Microsoft gained ahead of its Build developer conference that kicks off Tuesday Dell Technologies shares dipped as it holds its own developer event NextDecade — Shares jumped after the UAEs stateowned oil company said it secured a stake in NextDecades Rio Grande liquefied natural gas or LNG export project NuScale Power — The nuclear power stock advanced Uranium stocks have recently gained after President Joe Biden signed a bill banning imports of Russian uranium for nuclear fuel Year to date NuScale is up more than — CNBCs Michelle Fox Lisa Kailai Han Alex Harring and Samantha Subin contributed reporting,Energy,Oil & Gas,positive,"1. The announcement of the UAE's state-owned oil company securing a stake in NextDecade's Rio Grande liquefied natural gas (LNG) export project indicates a growing interest and investment in the LNG sector. This could lead to increased demand for natural gas, the primary component of LNG, thus positively impacting the commodity's price and related stocks.

2. The positive sentiment around uranium stocks, which have recently gained after President Joe Biden signed a bill banning imports of Russian uranium for nuclear fuel, could indirectly benefit the natural gas industry. As nuclear power and natural gas are both significant sources of energy, the positive momentum in one sector can sometimes spill over into the other.

3. The overall positive tone of the news article towards the energy sector, with Microsoft's developer conference and Dell Technologies' developer event, could create a bullish sentiment for energy-related stocks, including those in the natural gas industry. This positive sentiment could drive up the prices of these stocks, including the one you own.","Several companies' stocks experienced significant movement midday. Hims & Hers Health, Norwegian Cruise Line, and Target were among those with notable changes. Dell Technologies' shares dipped as it held its developer event, while Microsoft gained ahead of its own conference. NextDecade's shares jumped after the UAE's state-owned oil company secured a stake in its Rio Grande LNG export project. NuScale Power, a nuclear power stock, advanced, partly due to recent gains in uranium stocks following a ban on Russian uranium imports.","""Microsoft, Dell, Norwegian Cruise Line, Target, Hims & Hers Health, NextDecade, NuScale Power, and Uranium Stocks Move Midday"""
1,413,https://www.marketbeat.com/stock-ideas/the-only-a-rated-stock-with-a-7-dividend/,1716363000,www.marketbeat.com,This pipeline company benefits from a 'toll-both' business model amid a boom in production volume - and growing distributions,The Only A-Rated Stock with a 7%+ Dividend,Natural Gas,Key Points EPD has increased distributions for consecutive years and has significant growth projects underway including the Bahia NGL Pipeline and Neches River NGL Export Facility US natural gas demand is expected to rise to billion cubic feet per day by and the US has become the worlds largest LNG exporter benefiting EPDs business EPD operates over miles of pipelines providing essential services for transporting and storing crude oil natural gas and NGLs stocks we like better than Enterprise Products Partners Imagine an investment that not only offers growth but also yields a stable dividend Enterprise Products Partners LP NYSE EPD is the only stock with an A rating from Standard Poors that offers such a lucrative yield Lets dive in EPD provides essential pipeline services for transporting and storing crude oil natural gas and natural gas liquids NGLs As one of the largest midstream energy companies the company manages a vast network of over miles of pipelines This broad scope hedges,Energy,Oil & Gas,positive,"1. The news article highlights the expected rise in US natural gas demand by 2023, which is a positive indicator for the Natural Gas sector. This increased demand could lead to higher prices and increased revenue for companies operating in this sector, including the one you own stocks in.

2. The article mentions the US becoming the world's largest LNG (Liquefied Natural Gas) exporter. This development is beneficial for Enterprise Products Partners (EPD), as they operate pipelines that provide essential services for transporting and storing natural gas and NGLs. Increased exports can lead to higher utilization rates and revenue for the company.

3. EPD has significant growth projects underway, including the Bahia NGL Pipeline and Neches River NGL Export Facility. These projects are expected to further enhance the company's capabilities in the Natural Gas sector, potentially leading to increased profits and dividends for shareholders.","The article highlights Enterprise Products Partners LP (EPD), an A-rated stock with a 7%+ dividend yield. EPD operates over 50,000 miles of pipelines, providing essential services for transporting and storing crude oil, natural gas, and NGLs. The company has increased distributions for consecutive years and has significant growth projects underway, including the Bahia NGL Pipeline and Neches River NGL Export Facility. US natural gas demand is expected to rise to 125 billion cubic feet per day by 2050, and the US has become the world's largest LNG exporter, benefiting EPD's business.","""EPD: A-Rated Stock with 7%+ Dividend and Significant Growth in Natural Gas Sector"""
