ArticleChunkID,ArticleID,Link,Published,Source,Summary,Title,name,Content,sector,industry,impact,reasons,news_summary,news_title
4,847,https://www.cnbc.com/2024/05/22/wednesdays-top-stock-calls-like-nvidia.html,1716404202,search.cnbc.com,Here are Wednesday's biggest calls on Wall Street.,"Here are Wednesday's biggest analyst calls: Nvidia, Meta, Tesla, Chipotle, Ferrari and more",Corn,that can help drive higher usage and incremental ad spend Maintain Buy Oppenheimer reiterates Chipotle as outperform Oppenheimer raised its price target on the stock to per share from CMGs relative menu pricing vs competition has improved since our October study highlighting its robust pricevalue as an ongoing traffic driver Goldman Sachs upgrades Shopify to buy from neutral Goldman Sachs said it sees a compelling entry point for shares of Shopify We upgrade Shopify from Neutral to Buy with upside to our updated month price target of Piper Sandler upgrades Kraft Heinz to overweight from neutral Piper Sandler said it has better visibility for the food products company We upgrade to OW with incrementally better visibility on KHCs upside in Foodservice helped by its new innovation in timesaving and laborsaving dispensers which we expect can drive incremental revenues within existing relationships and some incremental distribution Morgan Stanley reiterates McDonalds as overweight Morgan,Agriculture,Grains,positive,"1. Increased demand for corn due to potential growth in the fast-food industry, as suggested by the upgrade of McDonald's by Morgan Stanley. This could lead to higher consumption of corn-based products, such as high fructose corn syrup used in soft drinks and various processed foods.

2. Improved financial outlook for companies like Chipotle and Kraft Heinz, as indicated by the upgrade from Oppenheimer and Piper Sandler, respectively. This could lead to increased demand for corn as a raw material in their products, potentially driving up the price of corn.

3. The growth in e-commerce, as suggested by Goldman Sachs' upgrade of Shopify, could lead to increased demand for packaged and processed foods, many of which use corn as a primary ingredient. This could positively impact the demand for corn and, consequently, its price.","6 analysts made significant calls on Wednesday: Nvidia, Meta, Tesla, Chipotle, Ferrari, and others. Oppenheimer reiterated a buy rating for Chipotle, raising its price target to $1,850 per share, citing improved relative menu pricing and robust price-value as a traffic driver. Goldman Sachs upgraded Shopify to buy from neutral, seeing a compelling entry point for shares and setting a price target of $1,200. Piper Sandler upgraded Kraft Heinz to overweight from neutral, with better visibility for the food products company. Morgan Stanley reiterated its overweight rating for McDonald's.","""Analysts Upgrade and Reiterate Stocks: Chipotle, Shopify, Kraft Heinz, and McDonald's"""
3,945,https://www.cbsnews.com/news/us-news-world-report-best-places-to-live/,1716271265,www.cbsnews.com,Cities that score well on U.S. News' annual ranking of best cities get high marks for economic criteria like value and job market.,New ranking lists the best cities to live in the U.S.,Corn,the health of the local job market affordability of housing value quality of life and overall desirability The rankings are designed to help Americans make informed decisions about where to reside based on their priorities according to the media outlet To assess those priorities US News asked thousands of Americans what matters most to them when choosing place to live It created four indexes based on respondents answers weighted as follows Quality of Life Value Job Market Desirability The latter category takes into account factors such as weather number of bars and restaurants per capita and net migration This years findings reflected rising consumer concerns about career opportunities and a citys general affordability Quality of life remains Americans top priority and was therefore most heavily weighted to determine the rankings While inflation has come down in recent months Americans are still feeling the impact on their wallets so finding a place that is affordable and where they,Agriculture,Grains,negative,"1. The news article highlights concerns about career opportunities and affordability, which could indicate a potential decrease in consumer spending on non-essential items, including certain agricultural products like corn.
2. The focus on the local job market and housing affordability might suggest a shift in population trends, potentially leading to changes in demand for certain commodities in specific regions. If the regions where corn is primarily grown experience a decrease in population, it could negatively impact the demand for corn.
3. The overall desirability of certain areas might be affected by the factors mentioned in the article, such as weather and the number of bars and restaurants per capita. Changes in desirability could influence the demand for corn in those areas, leading to a negative impact on the commodity's price.","""The US News has ranked the best cities to live in the US, considering factors such as job market, affordability, quality of life, and desirability. The rankings are based on a survey of Americans' priorities, with quality of life being the most heavily weighted factor. This year's rankings reflect rising concerns about career opportunities and affordability.""","""US News Ranks Best Cities to Live in Based on Job Market, Affordability, and Quality of Life"""
14,454,https://www.marketbeat.com/learn/why-invest-in-5g-stocks/,1715871240,www.marketbeat.com,"5G technology represents a foundational shift in how we connect and interact with technology, and provides opportunities for potential growth and innovation.",Investing in 5G Stocks: Still an Opportunity,Corn,Understanding the diverse landscape of G investments — from infrastructure and hardware to service providers and application beneficiaries — is crucial By focusing on key players in the market and staying informed about industry trends and regulatory developments you can strategically position yourself to capitalize on the growth of G The current economic environment and the ongoing expansion of G coverage present a compelling case for both shortterm gains and longterm growth potential With careful analysis and a diversified approach investing in G stocks can be a profitable addition to any investment portfolio,Agriculture,Grains,negative,"1. The news article focuses on the growth of 'G' investments, which could potentially draw investor attention and capital away from traditional sectors like agriculture, leading to a decrease in demand for corn.
2. The 'G' industry's expansion might require significant infrastructure and hardware development, which could lead to an increase in the cost of raw materials, including corn, used in these industries. This could negatively impact the profitability of corn-related businesses.
3. The ongoing expansion of 'G' coverage might lead to regulatory developments that favor the 'G' industry at the expense of other sectors, including agriculture. This could create an unfavorable environment for corn-related businesses, leading to a decrease in their stock prices.","5G stocks remain a promising investment opportunity; understand the 5G landscape, focus on key players, and stay updated on industry trends and regulatory developments. The current economy and expanding 5G coverage offer potential for both short-term gains and long-term growth. Diversified, informed investments in 5G stocks can be profitable.","""Strategic 5G Investment: Focusing on Key Players and Industry Trends for Long-Term Growth"""
6,444,https://www.marketbeat.com/originals/deere-and-companys-q2-report-strong-revenue-cautious-outlook/,1715941800,www.marketbeat.com,"Deere & Company's Q2 earnings report reveals a complex scenario for the equipment giant, highlighting strong revenue, profitability, and industry challenges.","Deere & Company’s Q2 Report: Strong Revenue, Cautious Outlook",Soybeans,sectors challenges and subsequent impact on Deeres business Analysts are concerned about the nearterm outlook for the agricultural sector citing the impact of lower commodity prices higher input costs and declining farm income They are also watching for signs of improvement in the global economic environment which could provide some relief to the agricultural sector Analysts remain optimistic about Deeres longterm growth potential despite the nearterm headwinds They highlight the companys investments in technology such as precision agriculture and its commitment to sustainability initiatives as key drivers of future growth Deeres LongTerm Strategy Deere Company MarketRank Stock Analysis Overall MarketRank out of Analyst Rating Moderate Buy UpsideDownside Upside Short Interest Healthy Dividend Strength Moderate Sustainability News Sentiment Insider Trading NA Projected Earnings Growth See Full Details Despite the nearterm challenges facing the agricultural sector Deere Company remains,Agriculture,Grains,positive,"1. The news article mentions ""lower commodity prices"" as a challenge for the agricultural sector. If soybean prices have been low recently, any improvement in the agricultural sector could lead to an increase in soybean prices, which would positively impact your stocks.

2. The article also mentions ""declining farm income"" as a concern. If farmers have been struggling financially, any improvement in the agricultural sector could lead to increased demand for soybeans, as farmers may have more money to spend on inputs like seeds and fertilizers.

3. The news article highlights Deere's investments in technology and sustainability initiatives as key drivers of future growth. If Deere is a major player in the soybean industry, these investments could lead to increased efficiency and productivity in soybean production, which could positively impact the commodity's price and your stocks.","Deere & Company's Q2 report shows strong revenue but a cautious outlook due to challenges in the agricultural sector, including lower commodity prices, higher input costs, and declining farm income. Analysts are optimistic about Deere's long-term growth potential, highlighting the company's investments in technology and sustainability initiatives. The company's MarketRank is moderate buy, with a healthy upside and moderate sustainability.","""Deere & Company's Q2 Report: Strong Revenue, but Analysts Cautious on Near-Term Agricultural Sector Challenges and Long-Term Growth Potential"""
2,440,https://www.marketbeat.com/stock-ideas/3-vital-copper-stocks-helping-evs-and-ai-data-centers-take-off/,1716189000,www.marketbeat.com,"Three copper stocks could help investors get additional upside for their portfolios, especially if they are missing influence from the AI and EV trends",3 Vital Copper Stocks Helping EVs and AI Data Centers Take Off,Soybeans,new players popping up nearly every day many investors follow the hype behind these industries relatively blindly But trying to pick the winner among dozens of potential companies or spreading your eggs across many baskets hoping for one to win is akin to venture capital investing Thats not the goal here Get Hudbay Minerals alerts Sign Up A surefire way to guarantee a return on investment is by backing the necessary materials and industries that allow EVs and AI to take off Lithium already had its run in popularity giving copper a spot in line to become the next hot issue with stocks like Ero Copper Corp NYSE ERO Hudbay Minerals Inc NYSE HBM and Newmont Co NYSE NEM Why Copper Matters in These Trends Copper is a critical material for power distribution in data centers that house the most advanced computers dealing with machine learning and other AI computing processes Its also a crucial component in the batteries that guarantee EVs work and can scale to take on the combustion engines,Agriculture,Grains,positive,"1. The increasing demand for electric vehicles (EVs) and artificial intelligence (AI) technologies, as highlighted in the news article, is expected to boost the demand for copper, which is a critical material for these industries. This increased demand for copper could lead to a rise in the prices of other commodities, including soybeans, as investors become more optimistic about the overall commodities market.

2. The news article mentions that copper is a crucial component in the batteries that power EVs. As the demand for EVs continues to grow, the demand for copper is also expected to increase, which could lead to a rise in the prices of other commodities, including soybeans.

3. The article highlights that copper is also used in data centers that house advanced computers dealing with machine learning and other AI computing processes. As the demand for AI technologies continues to grow, the demand for copper is also expected to increase, which could lead to a rise in the prices of other commodities, including soybeans.","""The article highlights the growing importance of copper stocks in supporting the rise of electric vehicles (EVs) and AI data centers. As industries with numerous new players, investors often follow the hype without a clear strategy. The article suggests a surefire way to guarantee a return on investment is by backing necessary materials and industries that enable EVs and AI to take off. Copper is a critical material for power distribution in data centers and a crucial component in EV batteries. The article mentions three stocks: Ero Copper Corp (NYSE: ERO), Hudbay Minerals Inc (NYSE: HBM), and Newmont Co (NYSE: NEM), as potential investments in this trend.""","""Copper Stocks: A Promising Investment as Electric Vehicles and AI Data Centers Surge"""
4,847,https://www.cnbc.com/2024/05/22/wednesdays-top-stock-calls-like-nvidia.html,1716404202,search.cnbc.com,Here are Wednesday's biggest calls on Wall Street.,"Here are Wednesday's biggest analyst calls: Nvidia, Meta, Tesla, Chipotle, Ferrari and more",Soybeans,that can help drive higher usage and incremental ad spend Maintain Buy Oppenheimer reiterates Chipotle as outperform Oppenheimer raised its price target on the stock to per share from CMGs relative menu pricing vs competition has improved since our October study highlighting its robust pricevalue as an ongoing traffic driver Goldman Sachs upgrades Shopify to buy from neutral Goldman Sachs said it sees a compelling entry point for shares of Shopify We upgrade Shopify from Neutral to Buy with upside to our updated month price target of Piper Sandler upgrades Kraft Heinz to overweight from neutral Piper Sandler said it has better visibility for the food products company We upgrade to OW with incrementally better visibility on KHCs upside in Foodservice helped by its new innovation in timesaving and laborsaving dispensers which we expect can drive incremental revenues within existing relationships and some incremental distribution Morgan Stanley reiterates McDonalds as overweight Morgan,Agriculture,Grains,positive,"1. The upgrade of McDonald's by Morgan Stanley to overweight could indicate an anticipated increase in demand for soybeans, as McDonald's is a significant user of soybean products in their food offerings.
2. The positive outlook for Chipotle, as reiterated by Oppenheimer, could also contribute to a higher demand for soybeans, as Chipotle is known for its use of organic and sustainable ingredients, which may include soybeans.
3. The upgrade of Kraft Heinz by Piper Sandler might suggest an increase in the company's foodservice revenues, which could indirectly impact the demand for soybeans, as Kraft Heinz uses soybean products in some of its food offerings.","Several analysts have issued new ratings and price targets for various companies. Oppenheimer reiterated a buy rating for Chipotle and raised its price target to $2,000 per share, citing improved relative menu pricing and robust price-value. Goldman Sachs upgraded Shopify to buy from neutral, seeing a compelling entry point for shares and setting a price target of $1,400. Piper Sandler upgraded Kraft Heinz to overweight from neutral, citing better visibility for the company. Morgan Stanley reiterated an overweight rating for McDonald's.","""Analysts Upgrade Shopify, Kraft Heinz; Reiterate Buy Ratings for Chipotle, McDonald's"""
14,454,https://www.marketbeat.com/learn/why-invest-in-5g-stocks/,1715871240,www.marketbeat.com,"5G technology represents a foundational shift in how we connect and interact with technology, and provides opportunities for potential growth and innovation.",Investing in 5G Stocks: Still an Opportunity,Soybeans,Understanding the diverse landscape of G investments — from infrastructure and hardware to service providers and application beneficiaries — is crucial By focusing on key players in the market and staying informed about industry trends and regulatory developments you can strategically position yourself to capitalize on the growth of G The current economic environment and the ongoing expansion of G coverage present a compelling case for both shortterm gains and longterm growth potential With careful analysis and a diversified approach investing in G stocks can be a profitable addition to any investment portfolio,Agriculture,Grains,positive,"1. Increased Demand for Agricultural Products: The news article highlights the growth of ""G"" investments, which could lead to an increase in demand for agricultural products like soybeans. This is because as industries grow, they require more resources to sustain their operations, leading to a potential increase in the demand for soybeans.

2. Infrastructure Development: The news article mentions infrastructure as a key area of G investments. Improved infrastructure can benefit the agriculture sector by enhancing the transportation and distribution of goods, making it easier and more efficient to move soybeans from farms to consumers. This could positively impact the soybean industry and, in turn, your stocks.

3. Economic Growth: The news article suggests a compelling case for both short-term gains and long-term growth potential in G investments. This could indicate a broader economic expansion, which often leads to increased consumer spending and demand for goods, including agricultural products. As a result, the price of soybeans could rise, leading to a positive impact on your stocks.","5G stocks remain a promising investment opportunity; understand the 5G landscape, focus on key players, stay updated on trends and regulations. Current economic environment and 5G expansion offer potential for short-term gains and long-term growth. Diversified approach and careful analysis recommended for profitable investment.","""Strategic 5G Investing: Focus on Key Players and Industry Trends for Long-Term Growth"""
5,408,https://www.marketbeat.com/originals/reddits-openai-partnership-brings-a-fresh-new-upside/,1716370500,www.marketbeat.com,"Reddit stock is giving shareholders another reason to stick around, as the company is now partnering with OpenAI to further monetize its repertoire of data",Reddit’s OpenAI Partnership Brings a Fresh New Upside,Soybeans,months markets have bid up the stock to trade at x pricetosales PS Stocks typically trade at these types of premiums when markets expect aboveaverage growth or quality from the company’s sales One Ace up Reddit’s Sleeve Recently as if management was waiting for the hot quarterly release to settle into the stock price Reddit announced a new partnership with Elon Musk’s OpenAI showing investors just how important Reddit’s endless stream of data is to the advancement of artificial intelligence A rally upon the announcement was the market’s way of letting everyone know they were okay with this addition By combining Reddit’s data with ChatGPT capabilities management seeks to enhance user experience and be able to monetize AI licensing agreements through developers and other entities As early as last week analysts at Citigroup felt good enough about their projections using what little past data they could compile and relying heavily on assumptions It seems that Reddit’s future was clear,Agriculture,Grains,negative,"1. The positive news about Reddit's partnership with OpenAI and its potential to monetize AI licensing agreements may have shifted investor focus towards the technology sector, leading to a decrease in investments in other sectors, including agriculture.
2. The announcement could have caused a broader market rotation, where investors sell off stocks in certain sectors to invest in others, leading to a temporary decrease in the value of agriculture-related stocks, including those of companies that produce soybeans.
3. The news may have also highlighted the potential for AI to disrupt various industries, including agriculture, by improving efficiency and productivity. This could have led investors to reconsider the long-term growth prospects of traditional agricultural commodities like soybeans, causing a decrease in their value.","Reddit, a popular social media platform, has recently partnered with OpenAI, a company founded by Elon Musk. This partnership aims to enhance user experience and monetize AI licensing agreements through developers and other entities. The announcement of this partnership resulted in a stock rally, indicating a positive market response. Analysts at Citigroup have expressed optimism about Reddit's future, despite relying on limited past data and assumptions. The company's stock has been trading at a premium, suggesting that markets expect above-average growth or quality from its sales.","""Reddit Partners with OpenAI, Boosting Stock Value and AI Capabilities"""
6,444,https://www.marketbeat.com/originals/deere-and-companys-q2-report-strong-revenue-cautious-outlook/,1715941800,www.marketbeat.com,"Deere & Company's Q2 earnings report reveals a complex scenario for the equipment giant, highlighting strong revenue, profitability, and industry challenges.","Deere & Company’s Q2 Report: Strong Revenue, Cautious Outlook",Rice,sectors challenges and subsequent impact on Deeres business Analysts are concerned about the nearterm outlook for the agricultural sector citing the impact of lower commodity prices higher input costs and declining farm income They are also watching for signs of improvement in the global economic environment which could provide some relief to the agricultural sector Analysts remain optimistic about Deeres longterm growth potential despite the nearterm headwinds They highlight the companys investments in technology such as precision agriculture and its commitment to sustainability initiatives as key drivers of future growth Deeres LongTerm Strategy Deere Company MarketRank Stock Analysis Overall MarketRank out of Analyst Rating Moderate Buy UpsideDownside Upside Short Interest Healthy Dividend Strength Moderate Sustainability News Sentiment Insider Trading NA Projected Earnings Growth See Full Details Despite the nearterm challenges facing the agricultural sector Deere Company remains,Agriculture,Grains,negative,"1. The news article mentions lower commodity prices as a challenge for the agricultural sector, which could negatively impact the price of rice.
2. The article also highlights higher input costs as a concern for the sector, which could lead to reduced profitability for rice farmers and companies like Deere that supply agricultural equipment.
3. The declining farm income mentioned in the article could lead to decreased demand for rice and other agricultural commodities, further impacting the price and profitability of the commodity.","""Deere & Company's Q2 report shows strong revenue but a cautious outlook due to challenges in the agricultural sector, such as lower commodity prices, higher input costs, and declining farm income. Analysts remain optimistic about Deere's long-term growth potential, highlighting the company's investments in technology and sustainability initiatives. The company has a moderate buy rating, healthy short interest, and moderate dividend strength.""","""Deere & Company's Q2 Report: Strong Revenue, but Analysts Cautious on Near-Term Agricultural Sector Outlook and Long-Term Growth Potential"""
