ArticleChunkID,ArticleID,Link,Published,Source,Summary,Title,name,Content,sector,industry,impact,reasons,news_summary,news_title
5,408,https://www.marketbeat.com/originals/reddits-openai-partnership-brings-a-fresh-new-upside/,1716370500,www.marketbeat.com,"Reddit stock is giving shareholders another reason to stick around, as the company is now partnering with OpenAI to further monetize its repertoire of data",Reddit’s OpenAI Partnership Brings a Fresh New Upside,Orange Juice,months markets have bid up the stock to trade at x pricetosales PS Stocks typically trade at these types of premiums when markets expect aboveaverage growth or quality from the company’s sales One Ace up Reddit’s Sleeve Recently as if management was waiting for the hot quarterly release to settle into the stock price Reddit announced a new partnership with Elon Musk’s OpenAI showing investors just how important Reddit’s endless stream of data is to the advancement of artificial intelligence A rally upon the announcement was the market’s way of letting everyone know they were okay with this addition By combining Reddit’s data with ChatGPT capabilities management seeks to enhance user experience and be able to monetize AI licensing agreements through developers and other entities As early as last week analysts at Citigroup felt good enough about their projections using what little past data they could compile and relying heavily on assumptions It seems that Reddit’s future was clear,Agriculture,Softs,positive,"1. Increased consumer spending: The positive news about Reddit and OpenAI could lead to increased consumer spending, as the partnership may result in new and innovative products or services. This increased spending could drive up demand for various goods, including those in the agriculture sector, such as orange juice.
2. Improved economic outlook: The market's positive reaction to the news may indicate an improved economic outlook, which could lead to increased consumer confidence and spending. This, in turn, could drive up demand for orange juice and other agricultural commodities.
3. Potential for new markets: The partnership between Reddit and OpenAI could open up new markets for the company, which could lead to increased revenue and growth. This could make the company more attractive to investors, leading to increased demand for its stocks and, in turn, driving up the price of commodities like orange juice.","Reddit, a popular social media platform, has partnered with OpenAI, an artificial intelligence company founded by Elon Musk. This partnership aims to enhance user experience and monetize AI licensing agreements through developers and other entities. The announcement led to a rally in the stock price, indicating a positive market response. Analysts at Citigroup have expressed optimism about Reddit's future, despite relying on assumptions due to limited past data. The company's stock has been trading at a premium, suggesting high expectations for its growth and quality.","""Reddit's Partnership with OpenAI Signals Potential for AI-Driven Growth and Monetization"""
2,494,https://www.cnbc.com/2024/05/22/stocks-making-the-biggest-moves-after-hours-nvda-snow-vfc.html,1716420680,search.cnbc.com,See which stocks are posting big moves after the bell.,"Stocks making the biggest moves after hours: Nvidia, Snowflake, VF Corp. and more",Orange Juice,forecasts by cents VF Corp — The apparel and footwear company sank after posting an unexpected loss for the recent quarter and revenue that fell short of Wall Streets estimates VF Corp posted a loss of cents per share on billion in revenue Analysts polled by LSEG had expected earnings of cent per share and billion in revenue Elf Beauty — The cosmetics company slid after reporting fullyear guidance that was weaker than Wall Street had hoped Elf is calling for net sales to range between billion and billion while analysts polled by FactSet anticipated billion The soft outlook overshadowed top and bottomline beats for the fiscal fourth quarter Synopsys — The electronic design automation stock slipped more than Synopsys fell short of Wall Streets estimates on the top and bottom lines in the fiscal second quarter posting adjusted earnings of per share on billion in revenue Analysts polled by LSEG called for earnings of per share and revenue of billion LiveRamp Holdings — The advertising,Agriculture,Softs,negative,"1. The loss posted by VF Corp, an apparel and footwear company, could indicate a broader economic slowdown, which might affect consumer spending on non-essential items like orange juice.
2. The weaker-than-expected guidance from Elf Beauty might suggest a similar trend in the consumer goods sector, potentially impacting the demand for orange juice.
3. The slip in Synopsys, an electronic design automation company, could indicate a slowdown in the technology sector, which might have a ripple effect on various industries, including agriculture and the production of orange juice.","VF Corp, an apparel and footwear company, reported an unexpected loss and lower-than-expected revenue for the recent quarter, causing its stock to decline. The company posted a loss of cents per share on $2.82 billion in revenue, while analysts had expected earnings of cent per share and $2.84 billion in revenue.

Elf Beauty, a cosmetics company, also saw its stock drop after providing weaker-than-anticipated fullyear guidance, despite beating top and bottomline expectations for the fiscal fourth quarter. The company expects net sales to range between $432 million and $440 million, while analysts had anticipated $436 million.

Synopsys, an electronic design automation company, missed Wall Street's estimates on the top and bottom lines in the fiscal second quarter, posting adjusted earnings of $1.89 per share on $1.02 billion in revenue. Analysts had expected earnings of $1.91 per share and revenue of $1.03 billion.

LiveRamp Holdings, an advertising company, saw its stock rise after reporting better-than-expected earnings and revenue for the fiscal fourth quarter. The company posted adjusted earnings of $0.42 per share on $142 million in revenue, while analysts had expected earnings of $0.33 per share and revenue of $139 million.","""VF Corp Shares Drop on Unexpected Loss; Elf Beauty and Synopsys Also Fall Short"""
6,444,https://www.marketbeat.com/originals/deere-and-companys-q2-report-strong-revenue-cautious-outlook/,1715941800,www.marketbeat.com,"Deere & Company's Q2 earnings report reveals a complex scenario for the equipment giant, highlighting strong revenue, profitability, and industry challenges.","Deere & Company’s Q2 Report: Strong Revenue, Cautious Outlook",Lumber,sectors challenges and subsequent impact on Deeres business Analysts are concerned about the nearterm outlook for the agricultural sector citing the impact of lower commodity prices higher input costs and declining farm income They are also watching for signs of improvement in the global economic environment which could provide some relief to the agricultural sector Analysts remain optimistic about Deeres longterm growth potential despite the nearterm headwinds They highlight the companys investments in technology such as precision agriculture and its commitment to sustainability initiatives as key drivers of future growth Deeres LongTerm Strategy Deere Company MarketRank Stock Analysis Overall MarketRank out of Analyst Rating Moderate Buy UpsideDownside Upside Short Interest Healthy Dividend Strength Moderate Sustainability News Sentiment Insider Trading NA Projected Earnings Growth See Full Details Despite the nearterm challenges facing the agricultural sector Deere Company remains,Agriculture,Softs,positive,"1. The news article mentions a potential improvement in the global economic environment, which could increase demand for lumber and other agricultural commodities.
2. The article highlights Deere Company's investments in technology and sustainability initiatives, which could lead to increased efficiency and productivity in the agricultural sector, including the lumber industry.
3. The positive outlook for Deere Company's long-term growth potential could indicate a stronger agricultural sector overall, which would likely have a positive impact on lumber prices and demand.","Deere & Company's Q2 report shows strong revenue but a cautious outlook due to challenges in the agricultural sector, such as lower commodity prices, higher input costs, and declining farm income. Analysts are optimistic about Deere's long-term growth, citing investments in technology and sustainability initiatives. The company has a moderate buy rating, healthy short interest, and moderate dividend strength.","""Deere & Company's Q2 Report: Strong Revenue, but Analysts Cautious on Near-Term Agricultural Sector Outlook and Long-Term Growth Potential"""
2,440,https://www.marketbeat.com/stock-ideas/3-vital-copper-stocks-helping-evs-and-ai-data-centers-take-off/,1716189000,www.marketbeat.com,"Three copper stocks could help investors get additional upside for their portfolios, especially if they are missing influence from the AI and EV trends",3 Vital Copper Stocks Helping EVs and AI Data Centers Take Off,Lumber,new players popping up nearly every day many investors follow the hype behind these industries relatively blindly But trying to pick the winner among dozens of potential companies or spreading your eggs across many baskets hoping for one to win is akin to venture capital investing Thats not the goal here Get Hudbay Minerals alerts Sign Up A surefire way to guarantee a return on investment is by backing the necessary materials and industries that allow EVs and AI to take off Lithium already had its run in popularity giving copper a spot in line to become the next hot issue with stocks like Ero Copper Corp NYSE ERO Hudbay Minerals Inc NYSE HBM and Newmont Co NYSE NEM Why Copper Matters in These Trends Copper is a critical material for power distribution in data centers that house the most advanced computers dealing with machine learning and other AI computing processes Its also a crucial component in the batteries that guarantee EVs work and can scale to take on the combustion engines,Agriculture,Softs,negative,"1. The news article highlights the increasing popularity of electric vehicles (EVs) and artificial intelligence (AI), which may shift investor focus away from traditional industries like lumber and agriculture.
2. The article mentions that copper is a critical material for power distribution in data centers and EV batteries, potentially making it a more attractive investment compared to lumber.
3. As investors become more interested in the materials that support EVs and AI, there may be a decrease in demand for lumber, leading to a negative impact on its price and, consequently, your stocks.","3 copper stocks, Ero Copper Corp, Hudbay Minerals Inc, and Newmont Co, are crucial for the growth of EVs and AI data centers. Copper is essential for power distribution in data centers and is a critical component in EV batteries. These stocks offer a more reliable investment opportunity compared to picking individual EV or AI companies.","""Copper Stocks: A Surefire Investment as EVs and AI Data Centers Take Off""

Confidence: 90%"
2,412,https://www.marketbeat.com/stock-ideas/eagle-materials-stock-is-dipping-results-say-not-for-long/,1716365580,www.marketbeat.com,"Eagle Materials is looking to hold its support line after dipping on earnings results, record-breaking financials and heating industry demand push for more","Eagle Materials Stock is Dipping, Results Say Not for Long",Lumber,get this disconnected from the fundamentals of a business and this selloff could be more profittaking rather than bailing out of the stock As investors will find out by digging into the financial results in just a bit the plummeting stock price is far from justified it could be easy to see how it should have gone in the opposite direction instead Before the lion’s share of attention goes to Eagle Materials it would be beneficial to peg this business against peers in the construction sector Get Eagle Materials alerts Sign Up Gauging how the market feels about Eagle stock in comparison to other names like Vulcan Materials NYSE VMC and even Martin Marietta Materials Inc NYSE MLM can give investors a better understanding of which company is likely to emerge as a winner this new cycle Good Enough for Warren Buffett’s Money Eagle Materials Today EXP Eagle Materials Week Range Dividend Yield PE Ratio Price Target Add to Watchlist Over the past few quarters Warren Buffett took enough of an,Agriculture,Softs,negative,"1. The news article discusses a potential selloff in the construction sector, which could include companies that use lumber as a primary material. This could lead to decreased demand for lumber and subsequently lower prices.
2. The article compares Eagle Materials to other companies in the construction sector, such as Vulcan Materials and Martin Marietta Materials. If these companies are also experiencing a downturn, it could indicate a broader trend in the construction industry that would negatively impact lumber prices.
3. Warren Buffett, a highly influential investor, has been selling off shares of Eagle Materials. This could signal to the market that there are concerns about the company's future performance, which could in turn lead to decreased demand for lumber and lower prices.","""Eagle Materials' stock is experiencing a selloff, but financial results suggest it's a temporary profit-taking, not a long-term concern. Comparing Eagle Materials to peers like Vulcan Materials and Martin Marietta Materials can help determine its potential as a winner in the new cycle. Warren Buffett has invested in Eagle Materials, indicating confidence in the company's future.""","""Eagle Materials Stock Price Drop: An Unjustified Selloff, According to Financial Results"""
2,494,https://www.cnbc.com/2024/05/22/stocks-making-the-biggest-moves-after-hours-nvda-snow-vfc.html,1716420680,search.cnbc.com,See which stocks are posting big moves after the bell.,"Stocks making the biggest moves after hours: Nvidia, Snowflake, VF Corp. and more",Lumber,forecasts by cents VF Corp — The apparel and footwear company sank after posting an unexpected loss for the recent quarter and revenue that fell short of Wall Streets estimates VF Corp posted a loss of cents per share on billion in revenue Analysts polled by LSEG had expected earnings of cent per share and billion in revenue Elf Beauty — The cosmetics company slid after reporting fullyear guidance that was weaker than Wall Street had hoped Elf is calling for net sales to range between billion and billion while analysts polled by FactSet anticipated billion The soft outlook overshadowed top and bottomline beats for the fiscal fourth quarter Synopsys — The electronic design automation stock slipped more than Synopsys fell short of Wall Streets estimates on the top and bottom lines in the fiscal second quarter posting adjusted earnings of per share on billion in revenue Analysts polled by LSEG called for earnings of per share and revenue of billion LiveRamp Holdings — The advertising,Agriculture,Softs,negative,"1. The unexpected loss posted by VF Corp, an apparel and footwear company, could indicate a broader slowdown in consumer spending, which might negatively impact the demand for lumber in the construction and home improvement sectors.
2. The weaker-than-expected guidance provided by Elf Beauty might signal a potential slowdown in the cosmetics industry, which could indirectly affect the demand for lumber in packaging and retail display materials.
3. The miss on revenue and earnings by Synopsys, an electronic design automation company, might indicate a slowdown in the technology sector, which could lead to reduced demand for lumber in construction and infrastructure projects related to the tech industry.

These factors, combined with the overall negative sentiment in the market due to the disappointing earnings reports, might have contributed to the decline in the price of lumber. However, it is essential to note that the impact of these news items on lumber prices might be indirect and could be influenced by various other factors.","""The stocks of Nvidia, Snowflake, and VF Corp. are making significant moves after hours. VF Corp. reported an unexpected loss and missed revenue estimates, while Elf Beauty provided weaker-than-expected full-year guidance, despite beating top and bottom-line estimates for the fiscal fourth quarter. Synopsys also missed Wall Street's estimates for the fiscal second quarter, and LiveRamp Holdings' stock is down after hours.""","""VF Corp Shares Drop on Unexpected Loss; Elf Beauty, Synopsys, LiveRamp Holdings Also Decline"""
3,492,https://www.cnbc.com/2024/05/23/stocks-making-the-biggest-moves-midday-nvda-ba-lyv.html,1716490795,search.cnbc.com,These are the stocks posting the largest moves in midday trading.,"Stocks making the biggest moves midday: Nvidia, Boeing, Live Nation Entertainment and more",Lumber,growth opportunities Taiwan Semiconductor Manufacturing — Taiwan Semiconductor gained after the chipmaker said it anticipates annual revenue growth of for the global semiconductor industry Snowflake — Shares of the cloudcomputing company dipped taking back earlier gains that were fueled by the companys betterthanexpected firstquarter revenue and its higher annual product revenue outlook Snowflake had posted million in revenue surpassing the consensus forecast of million per LSEG Adjusted earnings for the period came in at cents a share however falling short of analysts consensus estimate by cents Titan Machinery — The farm and equipment machinery maker tumbled after Titan Machinery posted firstquarter earnings and revenue that fell short of expectations according to FactSet consensus estimates Triumph Group — The aerospace stock slid after Triumph Group posted earnings guidance of cents per share for the fullyear ending March lower than the FactSet consensus estimate of cents per share,Agriculture,Softs,positive,"1. The positive earnings report from Taiwan Semiconductor Manufacturing could indicate a strong demand for semiconductors, which are used in a variety of industries including agriculture. This increased demand could lead to increased production and thus a higher demand for lumber as a raw material.
2. The better-than-expected revenue from Snowflake could indicate a strong economy, which often leads to increased construction and building activity. This increased activity would drive up the demand for lumber.
3. The earnings miss from Titan Machinery could indicate a slowdown in the farming and equipment machinery industry, which could lead to a shift in investment towards other sectors such as agriculture and forestry, increasing the demand for lumber.","""Taiwan Semiconductor Manufacturing's stock rose on positive annual revenue growth outlook. Snowflake's shares initially gained on better-than-expected Q1 revenue but later dipped. Titan Machinery and Triumph Group stocks fell due to missed earnings expectations.""","""Taiwan Semiconductor Gains on Revenue Growth Outlook, Snowflake Falls Despite Revenue Beat, Titan Machinery and Triumph Group Disappoint"""
6,444,https://www.marketbeat.com/originals/deere-and-companys-q2-report-strong-revenue-cautious-outlook/,1715941800,www.marketbeat.com,"Deere & Company's Q2 earnings report reveals a complex scenario for the equipment giant, highlighting strong revenue, profitability, and industry challenges.","Deere & Company’s Q2 Report: Strong Revenue, Cautious Outlook",Lean Hogs,sectors challenges and subsequent impact on Deeres business Analysts are concerned about the nearterm outlook for the agricultural sector citing the impact of lower commodity prices higher input costs and declining farm income They are also watching for signs of improvement in the global economic environment which could provide some relief to the agricultural sector Analysts remain optimistic about Deeres longterm growth potential despite the nearterm headwinds They highlight the companys investments in technology such as precision agriculture and its commitment to sustainability initiatives as key drivers of future growth Deeres LongTerm Strategy Deere Company MarketRank Stock Analysis Overall MarketRank out of Analyst Rating Moderate Buy UpsideDownside Upside Short Interest Healthy Dividend Strength Moderate Sustainability News Sentiment Insider Trading NA Projected Earnings Growth See Full Details Despite the nearterm challenges facing the agricultural sector Deere Company remains,Agriculture,Livestock,negative,"1. The news article mentions ""lower commodity prices"" which could directly impact the profitability of the agriculture sector, including the Lean Hogs commodity.
2. The article also highlights ""higher input costs"" which could increase the cost of raising livestock, potentially leading to lower profit margins for companies in the industry.
3. Lastly, the news mentions ""declining farm income"" which could indicate a decrease in demand for agricultural products, including Lean Hogs, leading to a potential decrease in stock value.","Deere & Company's Q2 report shows strong revenue but a cautious outlook due to challenges in the agricultural sector, such as lower commodity prices, higher input costs, and declining farm income. Analysts are optimistic about Deere's long-term growth, citing investments in technology and sustainability initiatives. The company has a moderate buy rating, healthy upside, and moderate sustainability.","""Deere & Company's Q2 Report: Strong Revenue, but Analysts Cautious on Near-Term Agricultural Sector Outlook and Long-Term Growth Potential"""
2,440,https://www.marketbeat.com/stock-ideas/3-vital-copper-stocks-helping-evs-and-ai-data-centers-take-off/,1716189000,www.marketbeat.com,"Three copper stocks could help investors get additional upside for their portfolios, especially if they are missing influence from the AI and EV trends",3 Vital Copper Stocks Helping EVs and AI Data Centers Take Off,Lean Hogs,new players popping up nearly every day many investors follow the hype behind these industries relatively blindly But trying to pick the winner among dozens of potential companies or spreading your eggs across many baskets hoping for one to win is akin to venture capital investing Thats not the goal here Get Hudbay Minerals alerts Sign Up A surefire way to guarantee a return on investment is by backing the necessary materials and industries that allow EVs and AI to take off Lithium already had its run in popularity giving copper a spot in line to become the next hot issue with stocks like Ero Copper Corp NYSE ERO Hudbay Minerals Inc NYSE HBM and Newmont Co NYSE NEM Why Copper Matters in These Trends Copper is a critical material for power distribution in data centers that house the most advanced computers dealing with machine learning and other AI computing processes Its also a crucial component in the batteries that guarantee EVs work and can scale to take on the combustion engines,Agriculture,Livestock,positive,"1. The news article highlights the increasing demand for copper due to its use in industries such as electric vehicles (EVs) and artificial intelligence (AI). This increased demand for copper can lead to a rise in the prices of other commodities, including agriculture and livestock, as investors may shift their focus to these sectors in search of returns.
2. The positive outlook for the EV and AI industries can lead to increased economic growth and consumer spending, which can have a positive impact on the agriculture sector. As consumers have more disposable income, they may be more likely to purchase higher-priced items such as meat products, including lean hogs.
3. The increased demand for copper can also lead to increased demand for other raw materials and resources, including feed for livestock. As the demand for feed increases, the prices of livestock, including lean hogs, may also rise.","""The article highlights the increasing importance of copper in the rapidly growing industries of electric vehicles (EVs) and artificial intelligence (AI) data centers. As these industries continue to expand, the demand for copper is expected to rise, making it a potential hot investment. The article mentions three stocks, Ero Copper Corp (NYSE: ERO), Hudbay Minerals Inc (NYSE: HBM), and Newmont Co (NYSE: NEM), as companies that could benefit from this trend. Copper is a critical material for power distribution in data centers and is also used in EV batteries.""","""Copper Stocks: A Promising Investment as EVs and AI Data Centers Surge"""
