ArticleChunkID,ArticleID,Link,Published,Source,Summary,Title,name,Content,sector,industry,impact,reasons,news_summary,news_title
7,445,https://www.marketbeat.com/originals/analysts-still-want-double-digit-upside-out-of-applied-materials/,1715940720,www.marketbeat.com,"Semiconductor stocks are coming to the U.S. to manufacture, and Applied Materials could see double-digit upside from this trend.",Analysts Still Want Double-Digit Upside Out of Applied Materials,Palladium,trades at of its week high Nvidia stock reached of its week high showing investors how winners will always attract bullish traders to bid them higher As an extension to Nvidia’s price action Applied Materials is flirting with making new alltime highs but wait there’s more Compared to the computer sector’s x PE multiple Applied Materials stock trades at x to bring a discount of to the industry The socalled smart money took notice which could be one reason behind the billion of institutional inflows into Applied Materials stock over the past months These institutions could be looking to close the stocks massive valuation gaps Before you consider Applied Materials youll want to hear this MarketBeat keeps track of Wall Streets toprated and best performing research analysts and the stocks they recommend to their clients on a daily basis MarketBeat has identified the five stocks that top analysts are quietly whispering to their clients to buy now before the broader market catches on and,Metals,Precious Metals,positive,"1. The positive performance of Nvidia and Applied Materials, as mentioned in the news article, can indicate a broader bullish trend in the technology sector. As Palladium is a crucial metal in the production of various technology components, an increase in demand for technology products could lead to an increase in demand for Palladium, thus positively impacting its price.

2. The news article highlights the significant institutional inflows into Applied Materials stock, indicating a strong interest from institutional investors in the technology sector. This increased interest could lead to a spillover effect, with these investors also considering other related sectors, such as precious metals like Palladium, for investment opportunities.

3. The positive sentiment around the technology sector, as reflected in the news article, could lead to an overall improvement in investor confidence. This improved confidence could extend to the precious metals sector, including Palladium, as investors look to diversify their portfolios with safe-haven assets.","Applied Materials stock is nearing all-time highs, with a discount of x to the computer sector's PE multiple. Over the past months, there has been a significant institutional inflow of $1 billion into the stock. Analysts see a double-digit upside for Applied Materials, with the stock trading at a lower PE ratio compared to the industry average. MarketBeat has identified five stocks that top analysts are recommending to their clients to buy now before the broader market catches on.","""Applied Materials Stock Attractive with Discounted PE and Strong Institutional Inflows"""
5,408,https://www.marketbeat.com/originals/reddits-openai-partnership-brings-a-fresh-new-upside/,1716370500,www.marketbeat.com,"Reddit stock is giving shareholders another reason to stick around, as the company is now partnering with OpenAI to further monetize its repertoire of data",Reddit’s OpenAI Partnership Brings a Fresh New Upside,Palladium,months markets have bid up the stock to trade at x pricetosales PS Stocks typically trade at these types of premiums when markets expect aboveaverage growth or quality from the company’s sales One Ace up Reddit’s Sleeve Recently as if management was waiting for the hot quarterly release to settle into the stock price Reddit announced a new partnership with Elon Musk’s OpenAI showing investors just how important Reddit’s endless stream of data is to the advancement of artificial intelligence A rally upon the announcement was the market’s way of letting everyone know they were okay with this addition By combining Reddit’s data with ChatGPT capabilities management seeks to enhance user experience and be able to monetize AI licensing agreements through developers and other entities As early as last week analysts at Citigroup felt good enough about their projections using what little past data they could compile and relying heavily on assumptions It seems that Reddit’s future was clear,Metals,Precious Metals,positive,"1. The positive market sentiment towards Reddit's partnership with OpenAI, which could potentially drive up demand for Palladium due to its use in various technological applications, such as in the production of electronic components and devices.
2. The potential for increased monetization of AI licensing agreements through developers and other entities, which could lead to higher revenues for companies involved in the production and sale of Palladium.
3. The overall positive outlook for the technology sector, which could drive up demand for Palladium as a key component in various technological applications, leading to higher prices for the commodity.","Reddit, a popular social media platform, has recently partnered with OpenAI, an organization founded by Elon Musk. This partnership aims to enhance user experience by combining Reddit's data with ChatGPT capabilities, and potentially monetize AI licensing agreements. The announcement led to a rally in the stock price, indicating a positive market response. Analysts at Citigroup have expressed optimism about Reddit's future, despite relying on assumptions due to limited past data. The article suggests that this partnership could be a significant growth catalyst for the company.","""Reddit's Partnership with OpenAI Signals Potential for AI-Driven Growth and Monetization"""
3,492,https://www.cnbc.com/2024/05/23/stocks-making-the-biggest-moves-midday-nvda-ba-lyv.html,1716490795,search.cnbc.com,These are the stocks posting the largest moves in midday trading.,"Stocks making the biggest moves midday: Nvidia, Boeing, Live Nation Entertainment and more",Palladium,growth opportunities Taiwan Semiconductor Manufacturing — Taiwan Semiconductor gained after the chipmaker said it anticipates annual revenue growth of for the global semiconductor industry Snowflake — Shares of the cloudcomputing company dipped taking back earlier gains that were fueled by the companys betterthanexpected firstquarter revenue and its higher annual product revenue outlook Snowflake had posted million in revenue surpassing the consensus forecast of million per LSEG Adjusted earnings for the period came in at cents a share however falling short of analysts consensus estimate by cents Titan Machinery — The farm and equipment machinery maker tumbled after Titan Machinery posted firstquarter earnings and revenue that fell short of expectations according to FactSet consensus estimates Triumph Group — The aerospace stock slid after Triumph Group posted earnings guidance of cents per share for the fullyear ending March lower than the FactSet consensus estimate of cents per share,Metals,Precious Metals,positive,"1. Taiwan Semiconductor Manufacturing's positive outlook: The growth in the semiconductor industry could lead to increased demand for palladium, as it is used in the production of various electronic components.

2. Snowflake's better-than-expected revenue: Although the company's shares dipped, its strong revenue performance indicates a healthy tech sector, which could indirectly boost demand for palladium in the production of tech products.

3. Titan Machinery's poor earnings: The underperformance of Titan Machinery might lead investors to shift their focus towards safer investments, such as precious metals like palladium. This increased demand could drive up the price of palladium.","Several stocks showed significant movement midday. Taiwan Semiconductor Manufacturing rose on anticipation of annual revenue growth. Snowflake initially gained on better-than-expected revenue but later dipped. Titan Machinery fell due to missed earnings and revenue expectations. Triumph Group also slid, posting lower earnings guidance than expected. Boeing and Live Nation Entertainment were among the other stocks mentioned in the article.","""Taiwan Semiconductor Grows, Snowflake and Titan Machinery Miss Estimates, Triumph Group Lowers Guidance"""
2,412,https://www.marketbeat.com/stock-ideas/eagle-materials-stock-is-dipping-results-say-not-for-long/,1716365580,www.marketbeat.com,"Eagle Materials is looking to hold its support line after dipping on earnings results, record-breaking financials and heating industry demand push for more","Eagle Materials Stock is Dipping, Results Say Not for Long",Palladium,get this disconnected from the fundamentals of a business and this selloff could be more profittaking rather than bailing out of the stock As investors will find out by digging into the financial results in just a bit the plummeting stock price is far from justified it could be easy to see how it should have gone in the opposite direction instead Before the lion’s share of attention goes to Eagle Materials it would be beneficial to peg this business against peers in the construction sector Get Eagle Materials alerts Sign Up Gauging how the market feels about Eagle stock in comparison to other names like Vulcan Materials NYSE VMC and even Martin Marietta Materials Inc NYSE MLM can give investors a better understanding of which company is likely to emerge as a winner this new cycle Good Enough for Warren Buffett’s Money Eagle Materials Today EXP Eagle Materials Week Range Dividend Yield PE Ratio Price Target Add to Watchlist Over the past few quarters Warren Buffett took enough of an,Metals,Precious Metals,negative,"1. The news article discusses a selloff in the construction sector, which could indicate a broader market trend affecting various industries, including precious metals like Palladium.
2. The article highlights Eagle Materials, a company in the construction sector, which may be experiencing profit-taking, leading to a decrease in its stock price. This could indirectly impact the price of Palladium, as a weaker construction sector may reduce demand for the metal.
3. The comparison of Eagle Materials to other companies like Vulcan Materials and Martin Marietta Materials may have caused a shift in investor sentiment, leading to a reallocation of funds and a potential decrease in demand for Palladium.","""Eagle Materials stock is experiencing a selloff, but financial results suggest it's a temporary profit-taking move, not a long-term concern. Comparing Eagle Materials to peers like Vulcan Materials and Martin Marietta Materials can help determine which company may lead the construction sector in the new cycle. Notably, Warren Buffett has shown interest in Eagle Materials in recent quarters.""","""Eagle Materials Stock Price Drop: An Unjustified Selloff, According to Financial Results"""
2,440,https://www.marketbeat.com/stock-ideas/3-vital-copper-stocks-helping-evs-and-ai-data-centers-take-off/,1716189000,www.marketbeat.com,"Three copper stocks could help investors get additional upside for their portfolios, especially if they are missing influence from the AI and EV trends",3 Vital Copper Stocks Helping EVs and AI Data Centers Take Off,Copper,new players popping up nearly every day many investors follow the hype behind these industries relatively blindly But trying to pick the winner among dozens of potential companies or spreading your eggs across many baskets hoping for one to win is akin to venture capital investing Thats not the goal here Get Hudbay Minerals alerts Sign Up A surefire way to guarantee a return on investment is by backing the necessary materials and industries that allow EVs and AI to take off Lithium already had its run in popularity giving copper a spot in line to become the next hot issue with stocks like Ero Copper Corp NYSE ERO Hudbay Minerals Inc NYSE HBM and Newmont Co NYSE NEM Why Copper Matters in These Trends Copper is a critical material for power distribution in data centers that house the most advanced computers dealing with machine learning and other AI computing processes Its also a crucial component in the batteries that guarantee EVs work and can scale to take on the combustion engines,Metals,Base Metals,positive,"1. The news article highlights copper as a critical material for power distribution in data centers that house advanced computers dealing with machine learning and other AI computing processes. This increased demand for copper in the technology sector is likely to drive up the price of the commodity.

2. Copper is also a crucial component in the batteries that ensure the functionality and scalability of electric vehicles (EVs). As the EV industry continues to grow, the demand for copper is expected to rise, positively impacting the commodity's price.

3. The news article mentions specific companies like Hudbay Minerals Inc and Ero Copper Corp, which operate within the copper industry. The positive outlook for these companies could lead to increased investor interest in the copper sector, driving up the prices of related commodities, including copper.","""The article highlights the growing importance of copper in the Electric Vehicles (EVs) and Artificial Intelligence (AI) data center industries. As these sectors expand, the demand for copper is expected to rise, making copper stocks a potential investment opportunity. The article mentions three specific stocks: Ero Copper Corp (NYSE: ERO), Hudbay Minerals Inc (NYSE: HBM), and Newmont Co (NYSE: NEM). Copper is a critical material for power distribution in data centers and a crucial component in EV batteries.""","""Copper Stocks: Key Players in the Rise of EVs and AI Data Centers"""
2,412,https://www.marketbeat.com/stock-ideas/eagle-materials-stock-is-dipping-results-say-not-for-long/,1716365580,www.marketbeat.com,"Eagle Materials is looking to hold its support line after dipping on earnings results, record-breaking financials and heating industry demand push for more","Eagle Materials Stock is Dipping, Results Say Not for Long",Copper,get this disconnected from the fundamentals of a business and this selloff could be more profittaking rather than bailing out of the stock As investors will find out by digging into the financial results in just a bit the plummeting stock price is far from justified it could be easy to see how it should have gone in the opposite direction instead Before the lion’s share of attention goes to Eagle Materials it would be beneficial to peg this business against peers in the construction sector Get Eagle Materials alerts Sign Up Gauging how the market feels about Eagle stock in comparison to other names like Vulcan Materials NYSE VMC and even Martin Marietta Materials Inc NYSE MLM can give investors a better understanding of which company is likely to emerge as a winner this new cycle Good Enough for Warren Buffett’s Money Eagle Materials Today EXP Eagle Materials Week Range Dividend Yield PE Ratio Price Target Add to Watchlist Over the past few quarters Warren Buffett took enough of an,Metals,Base Metals,negative,"1. The news article mentions a ""selloff"" and ""plummeting stock price"" in the construction sector, which could indicate a broader market trend affecting the demand for copper, a key material in construction.
2. The comparison of Eagle Materials to peers like Vulcan Materials and Martin Marietta Materials may suggest a shift in investor preference towards those companies, potentially impacting the demand and price of copper.
3. The mention of Warren Buffett's investment in Eagle Materials may have influenced the market's perception of the company, causing a ripple effect in related industries, including the copper market.","""Eagle Materials stock is experiencing a dip, but financial results suggest it's a potential buying opportunity. The selloff may be due to profit-taking rather than negative business fundamentals. Comparing Eagle Materials to peers like Vulcan Materials and Martin Marietta Materials can provide insight into which company is poised to excel in the current cycle. Notably, Warren Buffett has shown interest in Eagle Materials in recent quarters.""","""Eagle Materials Stock Price Drop: An Unjustified Selloff, According to Financial Results"""
7,445,https://www.marketbeat.com/originals/analysts-still-want-double-digit-upside-out-of-applied-materials/,1715940720,www.marketbeat.com,"Semiconductor stocks are coming to the U.S. to manufacture, and Applied Materials could see double-digit upside from this trend.",Analysts Still Want Double-Digit Upside Out of Applied Materials,Copper,trades at of its week high Nvidia stock reached of its week high showing investors how winners will always attract bullish traders to bid them higher As an extension to Nvidia’s price action Applied Materials is flirting with making new alltime highs but wait there’s more Compared to the computer sector’s x PE multiple Applied Materials stock trades at x to bring a discount of to the industry The socalled smart money took notice which could be one reason behind the billion of institutional inflows into Applied Materials stock over the past months These institutions could be looking to close the stocks massive valuation gaps Before you consider Applied Materials youll want to hear this MarketBeat keeps track of Wall Streets toprated and best performing research analysts and the stocks they recommend to their clients on a daily basis MarketBeat has identified the five stocks that top analysts are quietly whispering to their clients to buy now before the broader market catches on and,Metals,Base Metals,positive,"1. The positive performance of Nvidia and Applied Materials, as mentioned in the news article, often indicates a strong technology sector. This can lead to increased demand for copper, as it is a crucial component in many technological devices and infrastructure.

2. The bullish outlook for Applied Materials, a company that deals with materials engineering solutions for the semiconductor, flat panel display, and solar photovoltaic industries, could suggest an upcoming increase in production. This could lead to a higher demand for copper, as it is widely used in the production of semiconductors and other electronic components.

3. The significant institutional inflows into Applied Materials stock might indicate a broader market trend of investing in companies that rely on copper. This could lead to increased demand for copper, driving up its price.","Applied Materials stock is nearing all-time highs, with a discount of 15% to the computer sector's PE multiple, attracting institutional inflows of $1.3 billion in the past months. The stock is seen as a potential investment by ""smart money"" due to its valuation gap. Analysts suggest a double-digit upside for the stock.","""Applied Materials Stock: Analysts Predict Double-Digit Upside, Attracting Institutional Investors Despite Discount to Industry PE"""
3,492,https://www.cnbc.com/2024/05/23/stocks-making-the-biggest-moves-midday-nvda-ba-lyv.html,1716490795,search.cnbc.com,These are the stocks posting the largest moves in midday trading.,"Stocks making the biggest moves midday: Nvidia, Boeing, Live Nation Entertainment and more",Copper,growth opportunities Taiwan Semiconductor Manufacturing — Taiwan Semiconductor gained after the chipmaker said it anticipates annual revenue growth of for the global semiconductor industry Snowflake — Shares of the cloudcomputing company dipped taking back earlier gains that were fueled by the companys betterthanexpected firstquarter revenue and its higher annual product revenue outlook Snowflake had posted million in revenue surpassing the consensus forecast of million per LSEG Adjusted earnings for the period came in at cents a share however falling short of analysts consensus estimate by cents Titan Machinery — The farm and equipment machinery maker tumbled after Titan Machinery posted firstquarter earnings and revenue that fell short of expectations according to FactSet consensus estimates Triumph Group — The aerospace stock slid after Triumph Group posted earnings guidance of cents per share for the fullyear ending March lower than the FactSet consensus estimate of cents per share,Metals,Base Metals,positive,"1. The positive earnings report from Taiwan Semiconductor Manufacturing Company (TSMC) indicates a strong demand for semiconductors, which is a positive sign for the technology sector. Copper is widely used in the production of electronic devices and components, so an increase in demand for semiconductors could lead to an increase in demand for copper.

2. The better-than-expected first-quarter revenue and higher annual product revenue outlook from Snowflake could indicate a strong economic recovery, which could lead to increased industrial activity. Copper is a key metal used in industrial applications, so an increase in industrial activity could lead to an increase in demand for copper.

3. The earnings miss from Triumph Group, an aerospace company, could indicate a shift in focus towards more tech-focused industries, which could lead to increased demand for copper in the technology sector. Additionally, the earnings miss from Titan Machinery, a farm and equipment machinery maker, could indicate a slowdown in the agricultural sector, which could lead to a decrease in demand for copper in that sector. However, the positive impact from the technology sector could outweigh the negative impact from the agricultural sector, leading to an overall positive impact on copper prices.","Several stocks showed significant movement midday. Taiwan Semiconductor Manufacturing rose on positive annual revenue growth projections. Snowflake initially gained on better-than-expected Q1 revenue but later dipped. Titan Machinery and Triumph Group both fell, with Titan missing earnings and revenue expectations and Triumph providing lower-than-expected earnings guidance. Boeing also experienced a decline.","""Taiwan Semiconductor Grows, Snowflake and Titan Machinery Miss Estimates, Triumph Group Lowers Guidance"""
6,444,https://www.marketbeat.com/originals/deere-and-companys-q2-report-strong-revenue-cautious-outlook/,1715941800,www.marketbeat.com,"Deere & Company's Q2 earnings report reveals a complex scenario for the equipment giant, highlighting strong revenue, profitability, and industry challenges.","Deere & Company’s Q2 Report: Strong Revenue, Cautious Outlook",Copper,sectors challenges and subsequent impact on Deeres business Analysts are concerned about the nearterm outlook for the agricultural sector citing the impact of lower commodity prices higher input costs and declining farm income They are also watching for signs of improvement in the global economic environment which could provide some relief to the agricultural sector Analysts remain optimistic about Deeres longterm growth potential despite the nearterm headwinds They highlight the companys investments in technology such as precision agriculture and its commitment to sustainability initiatives as key drivers of future growth Deeres LongTerm Strategy Deere Company MarketRank Stock Analysis Overall MarketRank out of Analyst Rating Moderate Buy UpsideDownside Upside Short Interest Healthy Dividend Strength Moderate Sustainability News Sentiment Insider Trading NA Projected Earnings Growth See Full Details Despite the nearterm challenges facing the agricultural sector Deere Company remains,Metals,Base Metals,negative,"1. The news article mentions concerns about the near-term outlook for the agricultural sector, citing the impact of lower commodity prices. This could indirectly affect the demand for copper, as agricultural machinery and equipment often use copper as a key component. Lower demand for agricultural machinery could lead to a decrease in the demand for copper, causing its price to drop.

2. The article also mentions higher input costs in the agricultural sector. This could lead to a decrease in profits for companies in the agricultural sector, including those that use copper in their machinery and equipment. As a result, these companies may reduce their demand for copper, leading to a decrease in its price.

3. The news article highlights Deere Company's investments in technology such as precision agriculture and its commitment to sustainability initiatives. While these are positive long-term growth drivers for Deere, they may require significant upfront investments, which could temporarily reduce the company's demand for copper and other commodities. This could contribute to a short-term decrease in the price of copper.","""Deere & Company's Q2 report shows strong revenue but a cautious outlook due to challenges in the agricultural sector, such as lower commodity prices, higher input costs, and declining farm income. Analysts remain optimistic about Deere's long-term growth potential, highlighting the company's investments in technology and sustainability initiatives. The company's MarketRank is moderate buy, with a healthy upside and moderate sustainability.""","""Deere & Company's Q2 Report: Strong Revenue, but Analysts Cautious on Near-Term Agricultural Sector Challenges and Long-Term Growth Potential"""
